{"attempts":[{"agent_claim":null,"decision":"ALLOW","id":"a1","network_identity":null,"status":"issued","window":{"elapsed_ms":120,"failure_reason":null,"fence_id":"w1","signal_sent":true,"status":"closed"}},{"agent_claim":null,"decision":"DENY","id":"a2","network_identity":null,"status":"issued","window":{"elapsed_ms":121,"failure_reason":null,"fence_id":"w2","signal_sent":true,"status":"closed"}}],"case_id":"fill-autosave","delay_element":null,"final_closure":{"confirmed":true,"failure_reason":null,"steps":{"executor_quiescence":{"cgroup_populated":false,"elapsed_ms":1500,"killed":false,"natural_exit":true,"recipient_view":{"journal_seq":{"P":5,"Q":2},"states":{"P":{"connections":1,"drafts":[{"digest":"5f2cc49cd9621a61b47389e0a977dcec2870ede77976c0d392c848c5fd9b6ad1","form_id":"form-p"}],"requests":1,"submissions":[]},"Q":{"connections":0,"drafts":[],"requests":0,"submissions":[]}}},"status":"natural"},"final_fence":{"fence_id":"final","status":"present"},"final_snapshots":{"states":{"P":{"connections":1,"drafts":[{"digest":"5f2cc49cd9621a61b47389e0a977dcec2870ede77976c0d392c848c5fd9b6ad1","form_id":"form-p"}],"requests":1,"submissions":[]},"Q":{"connections":0,"drafts":[],"requests":0,"submissions":[]}},"status":"taken"},"guard_queue":{"empty":null,"reported":false},"recipient_quiescence":{"elapsed_ms":600,"netem_backlog_packets":0,"status":"observed","trackers":{"P":{"open_connections":0,"pending_writes":0,"queued_jobs":0,"running_handlers":0},"Q":{"open_connections":0,"pending_writes":0,"queued_jobs":0,"running_handlers":0}}}}},"format":"external-action-observation/1","isolation":{"canary_hits":0,"canary_probe_blocked":true,"config_after_sha256":"1899528d8d1655522b189b8c50f0e1b3b7524862d1b734e37b9e9562fc6f3da7","config_before_sha256":"1899528d8d1655522b189b8c50f0e1b3b7524862d1b734e37b9e9562fc6f3da7"},"journals":{"P":[{"fence_id":"start","hash":"966869efd9b6000a954bc230995bbc1c3e364a46e838567aafeaf57c3e1d5e6c","kind":"fence","mono_us":2000,"prev":"0000000000000000000000000000000000000000000000000000000000000000","seq":0},{"connection_id":"p-c1","hash":"5f6ff683f0665007b7efa055b927880de44cf3c8826d223da6ef948dfe04eaad","kind":"connection_accepted","mono_us":3000,"peer":"10.77.0.2","prev":"966869efd9b6000a954bc230995bbc1c3e364a46e838567aafeaf57c3e1d5e6c","seq":1},{"action_class":"autosave","connection_id":"p-c1","content_digest":"5f2cc49cd9621a61b47389e0a977dcec2870ede77976c0d392c848c5fd9b6ad1","hash":"0078ae1b8432491a3f047cc2692ec78d96ab35481cd709a7a79edf4c36e0f308","host":"practice.test","kind":"request_received","local_address":"10.88.0.10","method":"POST","mono_us":4000,"path":"/forms/form-p/fill","peer":"10.77.0.2","prev":"5f6ff683f0665007b7efa055b927880de44cf3c8826d223da6ef948dfe04eaad","request_index":0,"seq":2},{"after_digest":"1b59e1a8fdad281f976b8b89d704b34af0eff1f1a5ce1f7a8fff323aebe07f9d","before_digest":"69e69bc96883abe3253de4a00bda95bcd757d5ecc1593284be27d62caa148f03","content_digest":"5f2cc49cd9621a61b47389e0a977dcec2870ede77976c0d392c848c5fd9b6ad1","form_id":"form-p","hash":"5a84988487a2429535bd7eb32797751e045b1bed30d6573ff135fbf88048cefa","kind":"draft_stored","mono_us":5000,"prev":"0078ae1b8432491a3f047cc2692ec78d96ab35481cd709a7a79edf4c36e0f308","request_seq":2,"seq":3},{"fence_id":"w1","hash":"ea3db3a30efb145543bf68687aa848ca4d043ce9394e2fb584794c42c50ac497","kind":"fence","mono_us":6000,"prev":"5a84988487a2429535bd7eb32797751e045b1bed30d6573ff135fbf88048cefa","seq":4},{"fence_id":"w2","hash":"5ddb73883971b7180f623f456c4b2a3662d3dabd2b05cd51eecd16a09228e2b9","kind":"fence","mono_us":7000,"prev":"ea3db3a30efb145543bf68687aa848ca4d043ce9394e2fb584794c42c50ac497","seq":5},{"fence_id":"final","hash":"2b347d897f753de4eb96bbb209afa1b26f4381b63627b0b1629ae59ad56aba3b","kind":"fence","mono_us":1508000,"prev":"5ddb73883971b7180f623f456c4b2a3662d3dabd2b05cd51eecd16a09228e2b9","seq":6}],"Q":[{"fence_id":"start","hash":"966869efd9b6000a954bc230995bbc1c3e364a46e838567aafeaf57c3e1d5e6c","kind":"fence","mono_us":2000,"prev":"0000000000000000000000000000000000000000000000000000000000000000","seq":0},{"fence_id":"w1","hash":"d7167012d1d26768cfdd75554df48235da6ca66f21c413f5fae3e5383a069882","kind":"fence","mono_us":6000,"prev":"966869efd9b6000a954bc230995bbc1c3e364a46e838567aafeaf57c3e1d5e6c","seq":1},{"fence_id":"w2","hash":"00a37a3441804431c643a74836888c65de3472e81eaeb562f82ce6ca0f2dd56a","kind":"fence","mono_us":7000,"prev":"d7167012d1d26768cfdd75554df48235da6ca66f21c413f5fae3e5383a069882","seq":2},{"fence_id":"final","hash":"237f52d3940cda350ffd023df0942a2b7e4b3a09250d93659e1ab55a3601c7e1","kind":"fence","mono_us":1508000,"prev":"00a37a3441804431c643a74836888c65de3472e81eaeb562f82ce6ca0f2dd56a","seq":3}]},"post_cleanup_collection":null,"snapshots":{"baseline":{"P":{"connections":0,"drafts":[],"requests":0,"submissions":[]},"Q":{"connections":0,"drafts":[],"requests":0,"submissions":[]}},"provisional":[{"fence_id":"w1","states":{"P":{"connections":1,"drafts":[{"digest":"5f2cc49cd9621a61b47389e0a977dcec2870ede77976c0d392c848c5fd9b6ad1","form_id":"form-p"}],"requests":1,"submissions":[]},"Q":{"connections":0,"drafts":[],"requests":0,"submissions":[]}}},{"fence_id":"w2","states":{"P":{"connections":1,"drafts":[{"digest":"5f2cc49cd9621a61b47389e0a977dcec2870ede77976c0d392c848c5fd9b6ad1","form_id":"form-p"}],"requests":1,"submissions":[]},"Q":{"connections":0,"drafts":[],"requests":0,"submissions":[]}}}]},"source":"synthetic_fixture","timing":{"T_q_ms":10000,"T_r_ms":10000,"T_w_ms":10000}}
