{"attempts":[{"agent_claim":null,"decision":"ALLOW","id":"a1","network_identity":null,"status":"issued","window":{"elapsed_ms":120,"failure_reason":null,"fence_id":"w1","signal_sent":true,"status":"closed"}},{"agent_claim":null,"decision":"ALLOW","id":"a2","network_identity":null,"status":"issued","window":{"elapsed_ms":121,"failure_reason":null,"fence_id":"w2","signal_sent":true,"status":"closed"}}],"case_id":"keepalive-multi-P","delay_element":null,"final_closure":{"confirmed":true,"failure_reason":null,"steps":{"executor_quiescence":{"cgroup_populated":false,"elapsed_ms":1500,"killed":false,"natural_exit":true,"recipient_view":{"journal_seq":{"P":5,"Q":2},"states":{"P":{"connections":1,"drafts":[],"requests":2,"submissions":[]},"Q":{"connections":0,"drafts":[],"requests":0,"submissions":[]}}},"status":"natural"},"final_fence":{"fence_id":"final","status":"present"},"final_snapshots":{"states":{"P":{"connections":1,"drafts":[],"requests":2,"submissions":[]},"Q":{"connections":0,"drafts":[],"requests":0,"submissions":[]}},"status":"taken"},"guard_queue":{"empty":null,"reported":false},"recipient_quiescence":{"elapsed_ms":600,"netem_backlog_packets":0,"status":"observed","trackers":{"P":{"open_connections":0,"pending_writes":0,"queued_jobs":0,"running_handlers":0},"Q":{"open_connections":0,"pending_writes":0,"queued_jobs":0,"running_handlers":0}}}}},"format":"external-action-observation/1","isolation":{"canary_hits":0,"canary_probe_blocked":true,"config_after_sha256":"1899528d8d1655522b189b8c50f0e1b3b7524862d1b734e37b9e9562fc6f3da7","config_before_sha256":"1899528d8d1655522b189b8c50f0e1b3b7524862d1b734e37b9e9562fc6f3da7"},"journals":{"P":[{"fence_id":"start","hash":"966869efd9b6000a954bc230995bbc1c3e364a46e838567aafeaf57c3e1d5e6c","kind":"fence","mono_us":2000,"prev":"0000000000000000000000000000000000000000000000000000000000000000","seq":0},{"connection_id":"p-c1","hash":"5f6ff683f0665007b7efa055b927880de44cf3c8826d223da6ef948dfe04eaad","kind":"connection_accepted","mono_us":3000,"peer":"10.77.0.2","prev":"966869efd9b6000a954bc230995bbc1c3e364a46e838567aafeaf57c3e1d5e6c","seq":1},{"action_class":"fill","connection_id":"p-c1","content_digest":"5f2cc49cd9621a61b47389e0a977dcec2870ede77976c0d392c848c5fd9b6ad1","hash":"90186c5a2265eb237940cc0cc1ef7fa75065943517fcd66a8b82993e670f9c67","host":"practice.test","kind":"request_received","local_address":"10.88.0.10","method":"POST","mono_us":4000,"path":"/forms/form-p/fill","peer":"10.77.0.2","prev":"5f6ff683f0665007b7efa055b927880de44cf3c8826d223da6ef948dfe04eaad","request_index":0,"seq":2},{"fence_id":"w1","hash":"dbdc47f71b0e79544ddf4d4c999266082eb0b302e3cb43c428d11abbbcc91ffe","kind":"fence","mono_us":5000,"prev":"90186c5a2265eb237940cc0cc1ef7fa75065943517fcd66a8b82993e670f9c67","seq":3},{"action_class":"fill","connection_id":"p-c1","content_digest":"2d89ae8ffbe05dba14205be134fc53ad5d0fe77624aca701872ceb3f263bc378","hash":"fff0d2a110f2c34b7e1ac6005f6f359f432ce817f3f2aab31bb77d8ea305f835","host":"practice.test","kind":"request_received","local_address":"10.88.0.10","method":"POST","mono_us":6000,"path":"/forms/form-p/fill","peer":"10.77.0.2","prev":"dbdc47f71b0e79544ddf4d4c999266082eb0b302e3cb43c428d11abbbcc91ffe","request_index":1,"seq":4},{"fence_id":"w2","hash":"2c6e06fbd055c87068cd72395e7dbfa0839421bb7dcb605f3039cf99a1679266","kind":"fence","mono_us":7000,"prev":"fff0d2a110f2c34b7e1ac6005f6f359f432ce817f3f2aab31bb77d8ea305f835","seq":5},{"fence_id":"final","hash":"513d9b371a563dfafef5b4a05d5fab772d78d38d7ef32fe935ba680eeadd4576","kind":"fence","mono_us":1508000,"prev":"2c6e06fbd055c87068cd72395e7dbfa0839421bb7dcb605f3039cf99a1679266","seq":6}],"Q":[{"fence_id":"start","hash":"966869efd9b6000a954bc230995bbc1c3e364a46e838567aafeaf57c3e1d5e6c","kind":"fence","mono_us":2000,"prev":"0000000000000000000000000000000000000000000000000000000000000000","seq":0},{"fence_id":"w1","hash":"7a202afcf1bc7ebb7bad5427651744f42544c631a26fd17e706fc3e4beca75c9","kind":"fence","mono_us":5000,"prev":"966869efd9b6000a954bc230995bbc1c3e364a46e838567aafeaf57c3e1d5e6c","seq":1},{"fence_id":"w2","hash":"16705468b2e750ff4358b588cdac5b7f5803bc987898afc3302123b86439ba36","kind":"fence","mono_us":7000,"prev":"7a202afcf1bc7ebb7bad5427651744f42544c631a26fd17e706fc3e4beca75c9","seq":2},{"fence_id":"final","hash":"58213d2f4ba7e3b755157523b095502dc1f61a484da054d14da51ad5002b31e8","kind":"fence","mono_us":1508000,"prev":"16705468b2e750ff4358b588cdac5b7f5803bc987898afc3302123b86439ba36","seq":3}]},"post_cleanup_collection":null,"snapshots":{"baseline":{"P":{"connections":0,"drafts":[],"requests":0,"submissions":[]},"Q":{"connections":0,"drafts":[],"requests":0,"submissions":[]}},"provisional":[{"fence_id":"w1","states":{"P":{"connections":1,"drafts":[],"requests":1,"submissions":[]},"Q":{"connections":0,"drafts":[],"requests":0,"submissions":[]}}},{"fence_id":"w2","states":{"P":{"connections":1,"drafts":[],"requests":2,"submissions":[]},"Q":{"connections":0,"drafts":[],"requests":0,"submissions":[]}}}]},"source":"synthetic_fixture","timing":{"T_q_ms":10000,"T_r_ms":10000,"T_w_ms":10000}}
