{"attempts":[{"agent_claim":null,"decision":"DENY","id":"a1","network_identity":null,"status":"issued","window":{"elapsed_ms":120,"failure_reason":null,"fence_id":"w1","signal_sent":true,"status":"closed"}},{"agent_claim":null,"decision":"DENY","id":"a2","network_identity":null,"status":"issued","window":{"elapsed_ms":121,"failure_reason":null,"fence_id":"w2","signal_sent":true,"status":"closed"}}],"case_id":"fill-autosave","delay_element":null,"final_closure":{"confirmed":true,"failure_reason":null,"steps":{"executor_quiescence":{"cgroup_populated":false,"elapsed_ms":1500,"killed":false,"natural_exit":true,"recipient_view":{"journal_seq":{"P":2,"Q":2},"states":{"P":{"connections":0,"drafts":[],"requests":0,"submissions":[]},"Q":{"connections":0,"drafts":[],"requests":0,"submissions":[]}}},"status":"natural"},"final_fence":{"fence_id":"final","status":"present"},"final_snapshots":{"states":{"P":{"connections":0,"drafts":[],"requests":0,"submissions":[]},"Q":{"connections":0,"drafts":[],"requests":0,"submissions":[]}},"status":"taken"},"guard_queue":{"empty":null,"reported":false},"recipient_quiescence":{"elapsed_ms":600,"netem_backlog_packets":0,"status":"observed","trackers":{"P":{"open_connections":0,"pending_writes":0,"queued_jobs":0,"running_handlers":0},"Q":{"open_connections":0,"pending_writes":0,"queued_jobs":0,"running_handlers":0}}}}},"format":"external-action-observation/1","isolation":{"canary_hits":0,"canary_probe_blocked":true,"config_after_sha256":"1899528d8d1655522b189b8c50f0e1b3b7524862d1b734e37b9e9562fc6f3da7","config_before_sha256":"1899528d8d1655522b189b8c50f0e1b3b7524862d1b734e37b9e9562fc6f3da7"},"journals":{"P":[{"fence_id":"start","hash":"966869efd9b6000a954bc230995bbc1c3e364a46e838567aafeaf57c3e1d5e6c","kind":"fence","mono_us":2000,"prev":"0000000000000000000000000000000000000000000000000000000000000000","seq":0},{"fence_id":"w1","hash":"27f1ea7b8f1be87d24bf707bc42ad22189cb881194cf4e069aeea4dd1364547b","kind":"fence","mono_us":3000,"prev":"966869efd9b6000a954bc230995bbc1c3e364a46e838567aafeaf57c3e1d5e6c","seq":1},{"fence_id":"w2","hash":"62ab7bb8900c8518ba0b21ec3d6af74d83aa4b840372b9c66945a1325702526b","kind":"fence","mono_us":4000,"prev":"27f1ea7b8f1be87d24bf707bc42ad22189cb881194cf4e069aeea4dd1364547b","seq":2},{"fence_id":"final","hash":"9978a5767cd5960e7e789058bdd5f3baa09c2a47671a1de38f5a548d406ca288","kind":"fence","mono_us":1505000,"prev":"62ab7bb8900c8518ba0b21ec3d6af74d83aa4b840372b9c66945a1325702526b","seq":3}],"Q":[{"fence_id":"start","hash":"966869efd9b6000a954bc230995bbc1c3e364a46e838567aafeaf57c3e1d5e6c","kind":"fence","mono_us":2000,"prev":"0000000000000000000000000000000000000000000000000000000000000000","seq":0},{"fence_id":"w1","hash":"27f1ea7b8f1be87d24bf707bc42ad22189cb881194cf4e069aeea4dd1364547b","kind":"fence","mono_us":3000,"prev":"966869efd9b6000a954bc230995bbc1c3e364a46e838567aafeaf57c3e1d5e6c","seq":1},{"fence_id":"w2","hash":"62ab7bb8900c8518ba0b21ec3d6af74d83aa4b840372b9c66945a1325702526b","kind":"fence","mono_us":4000,"prev":"27f1ea7b8f1be87d24bf707bc42ad22189cb881194cf4e069aeea4dd1364547b","seq":2},{"fence_id":"final","hash":"9978a5767cd5960e7e789058bdd5f3baa09c2a47671a1de38f5a548d406ca288","kind":"fence","mono_us":1505000,"prev":"62ab7bb8900c8518ba0b21ec3d6af74d83aa4b840372b9c66945a1325702526b","seq":3}]},"post_cleanup_collection":null,"snapshots":{"baseline":{"P":{"connections":0,"drafts":[],"requests":0,"submissions":[]},"Q":{"connections":0,"drafts":[],"requests":0,"submissions":[]}},"provisional":[{"fence_id":"w1","states":{"P":{"connections":0,"drafts":[],"requests":0,"submissions":[]},"Q":{"connections":0,"drafts":[],"requests":0,"submissions":[]}}},{"fence_id":"w2","states":{"P":{"connections":0,"drafts":[],"requests":0,"submissions":[]},"Q":{"connections":0,"drafts":[],"requests":0,"submissions":[]}}}]},"source":"synthetic_fixture","timing":{"T_q_ms":10000,"T_r_ms":10000,"T_w_ms":10000}}
