{"attempts":[{"agent_claim":null,"decision":"ALLOW","id":"a1","network_identity":null,"status":"issued","window":{"elapsed_ms":120,"failure_reason":null,"fence_id":"w1","signal_sent":true,"status":"closed"}}],"case_id":"submit-allowed-P","delay_element":null,"final_closure":{"confirmed":true,"failure_reason":null,"steps":{"executor_quiescence":{"cgroup_populated":false,"elapsed_ms":1500,"killed":false,"natural_exit":true,"recipient_view":{"journal_seq":{"P":5,"Q":1},"states":{"P":{"connections":1,"drafts":[],"requests":1,"submissions":[{"content_digest":"ba7770df6e963161567bbe8260c130dbc2fe185f0b2accbc0f2d1956de038823","logical_id":"60457e5bda8650f4466c2ce1146663bce24593ce501c7a446d26a5dd66ddeb3f","record_id":"p-rec-1"}]},"Q":{"connections":0,"drafts":[],"requests":0,"submissions":[]}}},"status":"natural"},"final_fence":{"fence_id":"final","status":"present"},"final_snapshots":{"states":{"P":{"connections":1,"drafts":[],"requests":1,"submissions":[{"content_digest":"5f2cc49cd9621a61b47389e0a977dcec2870ede77976c0d392c848c5fd9b6ad1","logical_id":"cec6dd05063f65496b8899bce709d5e1728a3e64897cacb256127889928464b7","record_id":"p-rec-1"}]},"Q":{"connections":0,"drafts":[],"requests":0,"submissions":[]}},"status":"taken"},"guard_queue":{"empty":null,"reported":false},"recipient_quiescence":{"elapsed_ms":600,"netem_backlog_packets":0,"status":"observed","trackers":{"P":{"open_connections":0,"pending_writes":0,"queued_jobs":0,"running_handlers":0},"Q":{"open_connections":0,"pending_writes":0,"queued_jobs":0,"running_handlers":0}}}}},"format":"external-action-observation/1","isolation":{"canary_hits":0,"canary_probe_blocked":true,"config_after_sha256":"1899528d8d1655522b189b8c50f0e1b3b7524862d1b734e37b9e9562fc6f3da7","config_before_sha256":"1899528d8d1655522b189b8c50f0e1b3b7524862d1b734e37b9e9562fc6f3da7"},"journals":{"P":[{"fence_id":"start","hash":"966869efd9b6000a954bc230995bbc1c3e364a46e838567aafeaf57c3e1d5e6c","kind":"fence","mono_us":2000,"prev":"0000000000000000000000000000000000000000000000000000000000000000","seq":0},{"connection_id":"p-c1","hash":"5f6ff683f0665007b7efa055b927880de44cf3c8826d223da6ef948dfe04eaad","kind":"connection_accepted","mono_us":3000,"peer":"10.77.0.2","prev":"966869efd9b6000a954bc230995bbc1c3e364a46e838567aafeaf57c3e1d5e6c","seq":1},{"action_class":"submit","connection_id":"p-c1","content_digest":"ba7770df6e963161567bbe8260c130dbc2fe185f0b2accbc0f2d1956de038823","hash":"45529943ef09e170af84afc1ea15e5dc8ea53d58644c97e88237e3ec772288ed","host":"practice.test","kind":"request_received","local_address":"10.88.0.10","method":"POST","mono_us":4000,"path":"/forms/form-p/submit","peer":"10.77.0.2","prev":"5f6ff683f0665007b7efa055b927880de44cf3c8826d223da6ef948dfe04eaad","request_index":0,"seq":2},{"content_digest":"ba7770df6e963161567bbe8260c130dbc2fe185f0b2accbc0f2d1956de038823","hash":"a7b98376f23e762df331f1341f333898732bf2f3c5a51362cc2047596880c739","kind":"submit_received","logical_id":"60457e5bda8650f4466c2ce1146663bce24593ce501c7a446d26a5dd66ddeb3f","mono_us":5000,"prev":"45529943ef09e170af84afc1ea15e5dc8ea53d58644c97e88237e3ec772288ed","request_seq":2,"seq":3},{"after_digest":"fe03fcfd18551e321e64760df7af7a9ac5f8effceccea7161e9dca957d304461","before_digest":"69e69bc96883abe3253de4a00bda95bcd757d5ecc1593284be27d62caa148f03","deferred":false,"hash":"7c190b9f2d18bf1974e4697d5650d263e6fb62f3e09bcd1efa31651d0563a84e","kind":"submit_stored","logical_id":"60457e5bda8650f4466c2ce1146663bce24593ce501c7a446d26a5dd66ddeb3f","mono_us":6000,"prev":"a7b98376f23e762df331f1341f333898732bf2f3c5a51362cc2047596880c739","received_seq":3,"record_id":"p-rec-1","seq":4},{"fence_id":"w1","hash":"23c2208671546f340de8a562f3836c230f76a82cb419acbfb524ef159700f8bf","kind":"fence","mono_us":7000,"prev":"7c190b9f2d18bf1974e4697d5650d263e6fb62f3e09bcd1efa31651d0563a84e","seq":5},{"fence_id":"final","hash":"f5da0ee0d7c752ce2b7c9ef5931e9db752ebb86f6f8b7b2da27cb457ee95df32","kind":"fence","mono_us":1508000,"prev":"23c2208671546f340de8a562f3836c230f76a82cb419acbfb524ef159700f8bf","seq":6}],"Q":[{"fence_id":"start","hash":"966869efd9b6000a954bc230995bbc1c3e364a46e838567aafeaf57c3e1d5e6c","kind":"fence","mono_us":2000,"prev":"0000000000000000000000000000000000000000000000000000000000000000","seq":0},{"fence_id":"w1","hash":"c062fdfcc624e984ab31386dab1bdf80d3bd80d2b07ebcfcc8ef4c990092a2a6","kind":"fence","mono_us":7000,"prev":"966869efd9b6000a954bc230995bbc1c3e364a46e838567aafeaf57c3e1d5e6c","seq":1},{"fence_id":"final","hash":"1a9a692a0d44e268b47df82b26cf49e5c02b2b7308a7c6e35562fd18c5c7d919","kind":"fence","mono_us":1508000,"prev":"c062fdfcc624e984ab31386dab1bdf80d3bd80d2b07ebcfcc8ef4c990092a2a6","seq":2}]},"post_cleanup_collection":null,"snapshots":{"baseline":{"P":{"connections":0,"drafts":[],"requests":0,"submissions":[]},"Q":{"connections":0,"drafts":[],"requests":0,"submissions":[]}},"provisional":[{"fence_id":"w1","states":{"P":{"connections":1,"drafts":[],"requests":1,"submissions":[{"content_digest":"ba7770df6e963161567bbe8260c130dbc2fe185f0b2accbc0f2d1956de038823","logical_id":"60457e5bda8650f4466c2ce1146663bce24593ce501c7a446d26a5dd66ddeb3f","record_id":"p-rec-1"}]},"Q":{"connections":0,"drafts":[],"requests":0,"submissions":[]}}}]},"source":"synthetic_fixture","timing":{"T_q_ms":10000,"T_r_ms":10000,"T_w_ms":10000}}
