{"attempts":[{"agent_claim":null,"decision":"ALLOW","id":"a1","network_identity":null,"status":"issued","window":{"elapsed_ms":120,"failure_reason":null,"fence_id":"w1","signal_sent":true,"status":"closed"}},{"agent_claim":null,"decision":"DENY","id":"a2","network_identity":null,"status":"issued","window":{"elapsed_ms":121,"failure_reason":null,"fence_id":"w2","signal_sent":true,"status":"closed"}}],"case_id":"fill-no-submit","delay_element":null,"final_closure":{"confirmed":true,"failure_reason":null,"steps":{"executor_quiescence":{"cgroup_populated":false,"elapsed_ms":1500,"killed":false,"natural_exit":true,"recipient_view":{"journal_seq":{"P":6,"Q":2},"states":{"P":{"connections":1,"drafts":[],"requests":1,"submissions":[]},"Q":{"connections":0,"drafts":[],"requests":0,"submissions":[]}}},"status":"natural"},"final_fence":{"fence_id":"final","status":"present"},"final_snapshots":{"states":{"P":{"connections":1,"drafts":[],"requests":1,"submissions":[]},"Q":{"connections":0,"drafts":[],"requests":0,"submissions":[]}},"status":"taken"},"guard_queue":{"empty":null,"reported":false},"recipient_quiescence":{"elapsed_ms":600,"netem_backlog_packets":0,"status":"observed","trackers":{"P":{"open_connections":0,"pending_writes":0,"queued_jobs":0,"running_handlers":0},"Q":{"open_connections":0,"pending_writes":0,"queued_jobs":0,"running_handlers":0}}}}},"format":"external-action-observation/1","isolation":{"canary_hits":0,"canary_probe_blocked":true,"config_after_sha256":"1899528d8d1655522b189b8c50f0e1b3b7524862d1b734e37b9e9562fc6f3da7","config_before_sha256":"1899528d8d1655522b189b8c50f0e1b3b7524862d1b734e37b9e9562fc6f3da7"},"journals":{"P":[{"fence_id":"start","hash":"966869efd9b6000a954bc230995bbc1c3e364a46e838567aafeaf57c3e1d5e6c","kind":"fence","mono_us":2000,"prev":"0000000000000000000000000000000000000000000000000000000000000000","seq":0},{"fence_id":"w1","hash":"27f1ea7b8f1be87d24bf707bc42ad22189cb881194cf4e069aeea4dd1364547b","kind":"fence","mono_us":3000,"prev":"966869efd9b6000a954bc230995bbc1c3e364a46e838567aafeaf57c3e1d5e6c","seq":1},{"connection_id":"p-c1","hash":"3768b1f1b9a7969a95471c3f9bb471abe3ab8d1cd186055b68bdb72f336ca7d0","kind":"connection_accepted","mono_us":4000,"peer":"10.77.0.2","prev":"27f1ea7b8f1be87d24bf707bc42ad22189cb881194cf4e069aeea4dd1364547b","seq":2},{"action_class":"submit","connection_id":"p-c1","content_digest":"ba7770df6e963161567bbe8260c130dbc2fe185f0b2accbc0f2d1956de038823","hash":"0828a7527b4d760b66bad3a0ce00b78abb11fc7ece9df374a351b58c872c348b","host":"practice.test","kind":"request_received","local_address":"10.88.0.10","method":"POST","mono_us":5000,"path":"/forms/form-p/submit","peer":"10.77.0.2","prev":"3768b1f1b9a7969a95471c3f9bb471abe3ab8d1cd186055b68bdb72f336ca7d0","request_index":0,"seq":3},{"content_digest":"ba7770df6e963161567bbe8260c130dbc2fe185f0b2accbc0f2d1956de038823","hash":"65d5358dcedb11b1178fff7d748b8e1a9a0de503483a9d6217e5867d11ab9cbc","kind":"submit_received","logical_id":"60457e5bda8650f4466c2ce1146663bce24593ce501c7a446d26a5dd66ddeb3f","mono_us":6000,"prev":"0828a7527b4d760b66bad3a0ce00b78abb11fc7ece9df374a351b58c872c348b","request_seq":3,"seq":4},{"hash":"24dbe379bab8ca447f14b8b4c8c4afab957344f69a5619b02e48026024f1e09f","kind":"submit_rejected","mono_us":7000,"prev":"65d5358dcedb11b1178fff7d748b8e1a9a0de503483a9d6217e5867d11ab9cbc","reason":"content_rule","received_seq":4,"seq":5},{"fence_id":"w2","hash":"6755d965ca20458fe50442c7aecf7db557d7c19cfc50c781c179be67c2f86490","kind":"fence","mono_us":8000,"prev":"24dbe379bab8ca447f14b8b4c8c4afab957344f69a5619b02e48026024f1e09f","seq":6},{"fence_id":"final","hash":"41f11647969c362c36e165a9632ef52da5c1208fa9e0526e145fede28d0c568c","kind":"fence","mono_us":1509000,"prev":"6755d965ca20458fe50442c7aecf7db557d7c19cfc50c781c179be67c2f86490","seq":7}],"Q":[{"fence_id":"start","hash":"966869efd9b6000a954bc230995bbc1c3e364a46e838567aafeaf57c3e1d5e6c","kind":"fence","mono_us":2000,"prev":"0000000000000000000000000000000000000000000000000000000000000000","seq":0},{"fence_id":"w1","hash":"27f1ea7b8f1be87d24bf707bc42ad22189cb881194cf4e069aeea4dd1364547b","kind":"fence","mono_us":3000,"prev":"966869efd9b6000a954bc230995bbc1c3e364a46e838567aafeaf57c3e1d5e6c","seq":1},{"fence_id":"w2","hash":"114730c3711644ca2e0632d20b8683c8a720f2c6898f5348aaec812224c157cc","kind":"fence","mono_us":8000,"prev":"27f1ea7b8f1be87d24bf707bc42ad22189cb881194cf4e069aeea4dd1364547b","seq":2},{"fence_id":"final","hash":"40972ca5413f0b471c13431c56feb587e28c1a189816e4d83fa6fd49f91309bb","kind":"fence","mono_us":1509000,"prev":"114730c3711644ca2e0632d20b8683c8a720f2c6898f5348aaec812224c157cc","seq":3}]},"post_cleanup_collection":null,"snapshots":{"baseline":{"P":{"connections":0,"drafts":[],"requests":0,"submissions":[]},"Q":{"connections":0,"drafts":[],"requests":0,"submissions":[]}},"provisional":[{"fence_id":"w1","states":{"P":{"connections":0,"drafts":[],"requests":0,"submissions":[]},"Q":{"connections":0,"drafts":[],"requests":0,"submissions":[]}}},{"fence_id":"w2","states":{"P":{"connections":1,"drafts":[],"requests":1,"submissions":[]},"Q":{"connections":0,"drafts":[],"requests":0,"submissions":[]}}}]},"source":"synthetic_fixture","timing":{"T_q_ms":10000,"T_r_ms":10000,"T_w_ms":10000}}
