{"attempts":[{"agent_claim":null,"decision":"UNKNOWN","id":"a1","network_identity":"10.77.1.1","status":"issued","window":{"elapsed_ms":120,"failure_reason":null,"fence_id":"w1","signal_sent":true,"status":"closed"}},{"agent_claim":null,"decision":"ALLOW","id":"a2","network_identity":"10.77.1.2","status":"issued","window":{"elapsed_ms":121,"failure_reason":null,"fence_id":"w2","signal_sent":true,"status":"closed"}}],"case_id":"retry-after-unsent","delay_element":null,"final_closure":{"confirmed":true,"failure_reason":null,"steps":{"executor_quiescence":{"cgroup_populated":false,"elapsed_ms":1500,"killed":false,"natural_exit":true,"recipient_view":{"journal_seq":{"P":6,"Q":2},"states":{"P":{"connections":1,"drafts":[],"requests":1,"submissions":[{"content_digest":"ba7770df6e963161567bbe8260c130dbc2fe185f0b2accbc0f2d1956de038823","logical_id":"60457e5bda8650f4466c2ce1146663bce24593ce501c7a446d26a5dd66ddeb3f","record_id":"p-rec-1"}]},"Q":{"connections":0,"drafts":[],"requests":0,"submissions":[]}}},"status":"natural"},"final_fence":{"fence_id":"final","status":"present"},"final_snapshots":{"states":{"P":{"connections":1,"drafts":[],"requests":1,"submissions":[{"content_digest":"ba7770df6e963161567bbe8260c130dbc2fe185f0b2accbc0f2d1956de038823","logical_id":"60457e5bda8650f4466c2ce1146663bce24593ce501c7a446d26a5dd66ddeb3f","record_id":"p-rec-1"}]},"Q":{"connections":0,"drafts":[],"requests":0,"submissions":[]}},"status":"taken"},"guard_queue":{"empty":null,"reported":false},"recipient_quiescence":{"elapsed_ms":600,"netem_backlog_packets":0,"status":"observed","trackers":{"P":{"open_connections":0,"pending_writes":0,"queued_jobs":0,"running_handlers":0},"Q":{"open_connections":0,"pending_writes":0,"queued_jobs":0,"running_handlers":0}}}}},"format":"external-action-observation/1","isolation":{"canary_hits":0,"canary_probe_blocked":true,"config_after_sha256":"1899528d8d1655522b189b8c50f0e1b3b7524862d1b734e37b9e9562fc6f3da7","config_before_sha256":"1899528d8d1655522b189b8c50f0e1b3b7524862d1b734e37b9e9562fc6f3da7"},"journals":{"P":[{"fence_id":"start","hash":"966869efd9b6000a954bc230995bbc1c3e364a46e838567aafeaf57c3e1d5e6c","kind":"fence","mono_us":2000,"prev":"0000000000000000000000000000000000000000000000000000000000000000","seq":0},{"fence_id":"w1","hash":"27f1ea7b8f1be87d24bf707bc42ad22189cb881194cf4e069aeea4dd1364547b","kind":"fence","mono_us":3000,"prev":"966869efd9b6000a954bc230995bbc1c3e364a46e838567aafeaf57c3e1d5e6c","seq":1},{"connection_id":"p-c1","hash":"7ce6be2f8df331db7bbd0a5b3c652cdcb409120685d1279c6788baa110912654","kind":"connection_accepted","mono_us":4000,"peer":"10.77.1.2","prev":"27f1ea7b8f1be87d24bf707bc42ad22189cb881194cf4e069aeea4dd1364547b","seq":2},{"action_class":"submit","connection_id":"p-c1","content_digest":"ba7770df6e963161567bbe8260c130dbc2fe185f0b2accbc0f2d1956de038823","hash":"13b60c3f8c898256859dbeb0e67f8922dbabd1449f249d2ec956aa4554fb6191","host":"practice.test","kind":"request_received","local_address":"10.88.0.10","method":"POST","mono_us":5000,"path":"/forms/form-p/submit","peer":"10.77.1.2","prev":"7ce6be2f8df331db7bbd0a5b3c652cdcb409120685d1279c6788baa110912654","request_index":0,"seq":3},{"content_digest":"ba7770df6e963161567bbe8260c130dbc2fe185f0b2accbc0f2d1956de038823","hash":"5375996129bb4a7cd407ff6739b4adb89f55743898b4688c4130a0d34268dd0b","kind":"submit_received","logical_id":"60457e5bda8650f4466c2ce1146663bce24593ce501c7a446d26a5dd66ddeb3f","mono_us":6000,"prev":"13b60c3f8c898256859dbeb0e67f8922dbabd1449f249d2ec956aa4554fb6191","request_seq":3,"seq":4},{"after_digest":"fe03fcfd18551e321e64760df7af7a9ac5f8effceccea7161e9dca957d304461","before_digest":"69e69bc96883abe3253de4a00bda95bcd757d5ecc1593284be27d62caa148f03","deferred":false,"hash":"00aecdc6c7194dd6fb84e61fd47adb184bacbf86fd4e1beb89de4161b09b6b4e","kind":"submit_stored","logical_id":"60457e5bda8650f4466c2ce1146663bce24593ce501c7a446d26a5dd66ddeb3f","mono_us":7000,"prev":"5375996129bb4a7cd407ff6739b4adb89f55743898b4688c4130a0d34268dd0b","received_seq":4,"record_id":"p-rec-1","seq":5},{"fence_id":"w2","hash":"dedf97617adf40da6129d839a5bcb1de49ef490e011b34ee018a841b59bbd7bf","kind":"fence","mono_us":8000,"prev":"00aecdc6c7194dd6fb84e61fd47adb184bacbf86fd4e1beb89de4161b09b6b4e","seq":6},{"fence_id":"final","hash":"7fffc6b429bf21c5e2878156d6aca8f26b89819c15669bc4c7b00c4209aca359","kind":"fence","mono_us":1509000,"prev":"dedf97617adf40da6129d839a5bcb1de49ef490e011b34ee018a841b59bbd7bf","seq":7}],"Q":[{"fence_id":"start","hash":"966869efd9b6000a954bc230995bbc1c3e364a46e838567aafeaf57c3e1d5e6c","kind":"fence","mono_us":2000,"prev":"0000000000000000000000000000000000000000000000000000000000000000","seq":0},{"fence_id":"w1","hash":"27f1ea7b8f1be87d24bf707bc42ad22189cb881194cf4e069aeea4dd1364547b","kind":"fence","mono_us":3000,"prev":"966869efd9b6000a954bc230995bbc1c3e364a46e838567aafeaf57c3e1d5e6c","seq":1},{"fence_id":"w2","hash":"114730c3711644ca2e0632d20b8683c8a720f2c6898f5348aaec812224c157cc","kind":"fence","mono_us":8000,"prev":"27f1ea7b8f1be87d24bf707bc42ad22189cb881194cf4e069aeea4dd1364547b","seq":2},{"fence_id":"final","hash":"40972ca5413f0b471c13431c56feb587e28c1a189816e4d83fa6fd49f91309bb","kind":"fence","mono_us":1509000,"prev":"114730c3711644ca2e0632d20b8683c8a720f2c6898f5348aaec812224c157cc","seq":3}]},"post_cleanup_collection":null,"snapshots":{"baseline":{"P":{"connections":0,"drafts":[],"requests":0,"submissions":[]},"Q":{"connections":0,"drafts":[],"requests":0,"submissions":[]}},"provisional":[{"fence_id":"w1","states":{"P":{"connections":0,"drafts":[],"requests":0,"submissions":[]},"Q":{"connections":0,"drafts":[],"requests":0,"submissions":[]}}},{"fence_id":"w2","states":{"P":{"connections":1,"drafts":[],"requests":1,"submissions":[{"content_digest":"ba7770df6e963161567bbe8260c130dbc2fe185f0b2accbc0f2d1956de038823","logical_id":"60457e5bda8650f4466c2ce1146663bce24593ce501c7a446d26a5dd66ddeb3f","record_id":"p-rec-1"}]},"Q":{"connections":0,"drafts":[],"requests":0,"submissions":[]}}}]},"source":"synthetic_fixture","timing":{"T_q_ms":10000,"T_r_ms":10000,"T_w_ms":10000}}
